{
  "slug": "rosas-kitchen",
  "name": "Rosa's Kitchen",
  "category": "restaurant",
  "address": "742 Elm Street, Austin, TX 78701, USA",
  "phone": "+1 512 555 0147",
  "website": null,
  "maps_url": "https://maps.google.com/?q=Rosa+Kitchen+Austin+TX",
  "hours": [
    "Monday: Closed",
    "Tuesday: 11:00 AM – 9:00 PM",
    "Wednesday: 11:00 AM – 9:00 PM",
    "Thursday: 11:00 AM – 9:00 PM",
    "Friday: 11:00 AM – 10:00 PM",
    "Saturday: 10:00 AM – 10:00 PM",
    "Sunday: 10:00 AM – 8:00 PM"
  ],
  "hours_note": "Rosa still does the Sunday roast herself. Kitchen closes 30 minutes before posted hours.",
  "reserve_url": null,
  "menu_url": null,
  "rating": 4.8,
  "review_count": 214,
  "reviews": [
    {
      "author": "Angela F.",
      "text": "Rosa came out to check on our table when my son wouldn't touch the vegetables. She brought him potatoes from the back — that's the kind of place this is.",
      "rating": 5
    },
    {
      "author": "Tom H.",
      "text": "Sunday roast is the reason we drive across town. Portions feed three if you're not greedy.",
      "rating": 5
    },
    {
      "author": "Linda G.",
      "text": "Cash and card. Kids get crayons and a bowl of tortilla chips while you wait.",
      "rating": 4
    }
  ],
  "photos": [
    "/photos/photo-1.svg",
    "/photos/photo-2.svg",
    "/photos/photo-3.svg",
    "/photos/photo-4.svg",
    "/photos/photo-5.svg"
  ],
  "menu": [
    {
      "category": "Rosa's signatures",
      "items": [
        {
          "name": "Sunday roast",
          "description": "Beef, Yorkshire pudding, gravy — Sundays from 11 AM until gone",
          "price": "$19",
          "photo": "/photos/photo-2.svg"
        },
        {
          "name": "Rosa's enchiladas",
          "description": "Family recipe, red or green sauce",
          "price": "$14"
        },
        {
          "name": "Homemade pie",
          "description": "Ask what's in the case today",
          "price": "$7",
          "photo": "/photos/photo-5.svg"
        }
      ]
    }
  ],
  "services_or_menu": [],
  "review_themes": [],
  "owner_name": "Rosa Mendez",
  "owner_story": "Rosa opened this kitchen in 1998 after twenty years cooking for her extended family. The Sunday roast started as a once-a-month gathering for neighbors on Elm Street — now it's the line out the door.",
  "faq": [],
  "private_dining_note": null,
  "social_url": null,
  "logo_url": null,
  "owner_provided_notes": "Family-run neighborhood kitchen. Rosa is usually in the dining room on weekends.",
  "headline": "Rosa's Sunday roast on Elm Street"
}
