{
  "slug": "pho-bun-co-lan",
  "name": "Phở & Bún Cô Lan",
  "category": "restaurant",
  "address": "142 Nguyễn Văn Thủ, Phường Đa Kao, Quận 1, Ho Chi Minh City, Vietnam",
  "phone": "+84 28 3822 4410",
  "website": null,
  "maps_url": "https://maps.google.com/?q=Pho+Bun+Co+Lan+Nguyen+Van+Thu",
  "hours": [
    "Monday: 6:00 AM – 2:00 PM",
    "Tuesday: 6:00 AM – 2:00 PM",
    "Wednesday: 6:00 AM – 2:00 PM",
    "Thursday: 6:00 AM – 2:00 PM",
    "Friday: 6:00 AM – 2:00 PM",
    "Saturday: 6:00 AM – 2:00 PM",
    "Sunday: Closed"
  ],
  "hours_note": "Hours from Google Maps. Kitchen closes when the broth pot runs out — usually before 2 PM.",
  "reserve_url": null,
  "menu_url": null,
  "rating": 4.5,
  "review_count": 312,
  "reviews": [
    {
      "author": "Minh T.",
      "text": "The phở tái here has clear broth — not greasy. I come before 7 AM when the herbs are still crisp.",
      "rating": 5
    },
    {
      "author": "Sarah K.",
      "text": "Walked over from the hotel for bún thịt nướng. Cash only, no English menu, but the staff pointed at what we wanted.",
      "rating": 4
    },
    {
      "author": "Hoàng L.",
      "text": "Same family running this counter for years. Phở portion is generous for the price.",
      "rating": 5
    }
  ],
  "photos": [
    "/photos/photo-1.svg",
    "/photos/photo-2.svg",
    "/photos/photo-3.svg",
    "/photos/photo-4.svg",
    "/photos/photo-5.svg"
  ],
  "menu": [],
  "services_or_menu": [],
  "review_themes": [
    { "name": "Phở tái", "note": "Clear beef broth, morning service" },
    { "name": "Bún thịt nướng", "note": "Grilled pork over rice noodles" },
    { "name": "Phở bò viên", "note": "Beef ball phở — regulars' pick" },
    { "name": "Cà phê sữa đá", "note": "Strong iced coffee after the bowl" }
  ],
  "owner_name": null,
  "owner_story": null,
  "faq": [],
  "private_dining_note": null,
  "social_url": null,
  "logo_url": null,
  "owner_provided_notes": "Neighborhood breakfast and lunch counter. Cash preferred.",
  "headline": "Morning phở on Nguyễn Văn Thủ"
}
