{
  "slug": "atelier-noir",
  "name": "Atelier Noir",
  "category": "restaurant",
  "address": "4 Rue du Cherche-Midi, 75006 Paris, France",
  "phone": "+33 1 42 22 8800",
  "website": "https://ateliernoir.example.fr",
  "maps_url": "https://maps.google.com/?q=Atelier+Noir+Paris",
  "hours": [
    "Monday: Closed",
    "Tuesday: Closed",
    "Wednesday: 7:30 PM – 10:30 PM",
    "Thursday: 7:30 PM – 10:30 PM",
    "Friday: 7:30 PM – 11:00 PM",
    "Saturday: 7:00 PM – 11:00 PM",
    "Sunday: Closed"
  ],
  "hours_note": "Single seating. Reservation required. Jacket suggested, not required.",
  "reserve_url": "https://ateliernoir.example.fr/reserve",
  "menu_url": null,
  "rating": 4.9,
  "review_count": 156,
  "reviews": [
    {
      "author": "Claire D.",
      "text": "Seven courses, no menu choices — you trust the kitchen. The langoustine course alone justified the reservation three months out.",
      "rating": 5
    },
    {
      "author": "Henrik A.",
      "text": "Service is invisible until you need something. Wine pairings are thoughtful without being lectured at.",
      "rating": 5
    }
  ],
  "photos": [
    "/photos/photo-1.svg",
    "/photos/photo-2.svg",
    "/photos/photo-3.svg",
    "/photos/photo-4.svg",
    "/photos/photo-5.svg"
  ],
  "menu": [
    {
      "category": "Tasting menu",
      "items": [
        {
          "name": "Seasonal tasting",
          "description": "Seven courses. Dietary restrictions with 48-hour notice.",
          "price": "€185"
        },
        {
          "name": "Wine pairing",
          "description": "Five glasses selected per course",
          "price": "€95"
        },
        {
          "name": "Langoustine",
          "description": "Signature course — Brittany, butter emulsion, citrus",
          "price": "—",
          "photo": "/photos/photo-2.svg"
        },
        {
          "name": "Pre-dessert",
          "description": "Palate cleanser before the pastry course",
          "price": "—"
        }
      ]
    }
  ],
  "services_or_menu": [],
  "review_themes": [],
  "owner_name": "Chef Marin Dubois",
  "owner_story": null,
  "faq": [
    {
      "question": "Is there an à la carte menu?",
      "answer": "No. All guests receive the seasonal tasting menu."
    },
    {
      "question": "How far in advance should I book?",
      "answer": "Reservations open on the first of each month for the following month. Weekends fill within hours."
    }
  ],
  "private_dining_note": "Salon privé for up to 10 guests. Chef's table available on request.",
  "social_url": null,
  "logo_url": null,
  "owner_provided_notes": "Reservation-only tasting menu. Single seating, Wednesday through Saturday.",
  "headline": "Seasonal tasting, single seating"
}
