{
  "slug": "trattoria-del-corso",
  "name": "Trattoria del Corso",
  "category": "restaurant",
  "address": "28 Via del Corso, 00186 Roma RM, Italy",
  "phone": "+39 06 678 4521",
  "website": "https://trattoriadelcorso.example.it",
  "maps_url": "https://maps.google.com/?q=Trattoria+del+Corso+Roma",
  "hours": [
    "Monday: 12:00 PM – 3:00 PM, 7:00 PM – 11:00 PM",
    "Tuesday: 12:00 PM – 3:00 PM, 7:00 PM – 11:00 PM",
    "Wednesday: Closed",
    "Thursday: 12:00 PM – 3:00 PM, 7:00 PM – 11:00 PM",
    "Friday: 12:00 PM – 3:00 PM, 7:00 PM – 11:00 PM",
    "Saturday: 12:00 PM – 3:00 PM, 7:00 PM – 11:30 PM",
    "Sunday: 12:00 PM – 3:00 PM, 7:00 PM – 11:00 PM"
  ],
  "hours_note": "Lunch and dinner service. Wednesday closed.",
  "reserve_url": null,
  "menu_url": "https://trattoriadelcorso.example.it/menu.pdf",
  "rating": 4.7,
  "review_count": 486,
  "reviews": [
    {
      "author": "Elena R.",
      "text": "Cacio e pepe made at the table — properly creamy, not swimming in butter. Book for dinner if you want a terrace table.",
      "rating": 5
    },
    {
      "author": "James P.",
      "text": "Lunch menu is good value. The amatriciana has real guanciale, not bacon.",
      "rating": 5
    },
    {
      "author": "Marco B.",
      "text": "House wine by the carafe is honest. Service is brisk at lunch, slower at dinner — as it should be.",
      "rating": 4
    }
  ],
  "photos": [
    "/photos/photo-1.svg",
    "/photos/photo-2.svg",
    "/photos/photo-3.svg",
    "/photos/photo-4.svg",
    "/photos/photo-5.svg",
    "/photos/photo-6.svg"
  ],
  "menu": [
    {
      "category": "Primi",
      "items": [
        {
          "name": "Cacio e pepe",
          "description": "Pecorino Romano, black pepper, tonnarelli",
          "price": "€14",
          "photo": "/photos/photo-2.svg"
        },
        {
          "name": "Amatriciana",
          "description": "Guanciale, tomato, pecorino",
          "price": "€13"
        },
        {
          "name": "Carbonara",
          "description": "Egg yolk, guanciale, pecorino — no cream",
          "price": "€14"
        }
      ]
    },
    {
      "category": "Secondi",
      "items": [
        {
          "name": "Saltimbocca alla romana",
          "description": "Veal, prosciutto, sage, white wine",
          "price": "€22"
        },
        {
          "name": "Coda alla vaccinara",
          "description": "Oxtail stew — Thursday special when available",
          "price": "€20"
        }
      ]
    }
  ],
  "services_or_menu": [],
  "review_themes": [],
  "owner_name": null,
  "owner_story": null,
  "faq": [
    {
      "question": "Do you take reservations?",
      "answer": "Walk-ins welcome at lunch. For dinner terrace tables, call before 6 PM."
    },
    {
      "question": "Is there a lunch menu?",
      "answer": "Yes — primi and secondi from the board, weekdays 12–3 PM."
    }
  ],
  "private_dining_note": null,
  "social_url": null,
  "logo_url": null,
  "owner_provided_notes": "Roman trattoria — pasta at the table, terrace in season.",
  "headline": "Roman pasta on Via del Corso"
}
